<!ELEMENT students (student+)>

<!ELEMENT student (name, age, gender, course)>

<!ELEMENT name (#PCDATA)>
<!ELEMENT age (#PCDATA)>
<!ELEMENT gender (#PCDATA)>
<!ELEMENT course (#PCDATA)>