<?xml version="1.0"?>

<!DOCTYPE students SYSTEM "Student.dtd">

<students>

    <student>
        <name>Rahul</name>
        <age>21</age>
        <gender>Male</gender>
        <course>Java</course>
    </student>

    <student>
        <name>Priya</name>
        <age>22</age>
        <gender>Female</gender>
        <course>Python</course>
    </student>

</students>